{
  "event_id": "3f9c2b1a-4d5e-4f60-8a71-2b3c4d5e6f70",
  "event_type": "request-created",
  "occurred_at": "2026-09-22T10:15:00Z",
  "request": {
    "id": "9c1f5e2d-7a3b-4c8d-9e0f-1a2b3c4d5e6f",
    "title": "Reset VPN access",
    "status": "created",
    "created_at": "2026-09-22T10:15:00Z"
  }
}